{
  "$schema": "https://json-schema.org/draft/2020-12/schema",
  "$id": "https://impresso.github.io/impresso-keyphrase/schemas/keyphrase/languages-summary.schema.json",
  "title": "Keyphrase languages summary",
  "description": "Summary JSON emitted when the keyphrase input sample is split into one JSONL file per language.",
  "type": "object",
  "required": [
    "input_path",
    "output_prefix",
    "language_field",
    "length_field",
    "total_records",
    "total_len",
    "invalid_json_lines",
    "languages",
    "languages_summary"
  ],
  "properties": {
    "input_path": {
      "type": "string",
      "description": "Input JSONL path used for the split step."
    },
    "output_prefix": {
      "type": "string",
      "description": "Output folder or S3 prefix containing per-language JSONL files."
    },
    "language_field": {
      "type": "string",
      "description": "Record field used as the language key."
    },
    "length_field": {
      "type": "string",
      "description": "Record field used for length aggregation."
    },
    "total_records": {
      "type": "integer",
      "description": "Total number of valid JSONL records written.",
      "minimum": 0
    },
    "total_len": {
      "type": "integer",
      "description": "Total text length over all records.",
      "minimum": 0
    },
    "invalid_json_lines": {
      "type": "integer",
      "description": "Number of invalid JSONL lines skipped.",
      "minimum": 0
    },
    "languages": {
      "type": "array",
      "description": "Language codes present in the output.",
      "items": {
        "type": "string",
        "description": "One language code.",
        "pattern": "^[A-Za-z0-9._-]+$"
      }
    },
    "languages_summary": {
      "type": "array",
      "description": "Per-language output statistics.",
      "items": {
        "type": "object",
        "required": ["language", "records", "total_len", "output_path"],
        "properties": {
          "language": {
            "type": "string",
            "description": "Language code or safe fallback bucket."
          },
          "records": {
            "type": "integer",
            "description": "Number of records for this language.",
            "minimum": 0
          },
          "total_len": {
            "type": "integer",
            "description": "Total text length for this language.",
            "minimum": 0
          },
          "output_path": {
            "type": "string",
            "description": "Per-language JSONL output path."
          }
        },
        "additionalProperties": true
      }
    }
  },
  "additionalProperties": true
}
